country,industry,source,name,text,type,created_at,rating
-,-,google-plus,106781030971063094758,"We&#39;ve got something exciting coming up this week! On Wednesday, I&#39;ll be a guest on <span class=""proflinkWrapper""><span class=""proflinkPrefix"">+</span><a class=""proflink"" href=""https://plus.google.com/105076725141939280120"" oid=""105076725141939280120"">Stephan Hovnanian</a></span> and <span class=""proflinkWrapper""><span class=""proflinkPrefix"">+</span><a class=""proflink"" href=""https://plus.google.com/102572320061138442096"" oid=""102572320061138442096"">Ben Fisher</a></span>&#39;s Google+ Business Spotlight!<br /><br />Discussion topics include a bit about Unbounce, how we use Google+ for our brand and ways to use landing pages for social. You can also ask questions ahead of time using the cool Q&amp;A app on the event page.<br /><br />Hope you RSVP &quot;Yes&quot; and I&#39;ll see you there :)<br /><br />Don&#39;t forget to use the  <a rel=""nofollow"" class=""ot-hashtag"" href=""https://plus.google.com/s/%23gplusspotlight"">#gplusspotlight</a>  and please share!<br /><br />— <span class=""proflinkWrapper""><span class=""proflinkPrefix"">+</span><a class=""proflink"" href=""https://plus.google.com/104430075112225882397"" oid=""104430075112225882397"">Tia Kelly</a></span>, Social Strategist  ﻿",link,1393267740,18
-,-,google-plus,106781030971063094758,"Common Misconceptions about <a rel=""nofollow"" class=""ot-hashtag"" href=""https://plus.google.com/s/%23Branding"">#Branding</a> from KISSMetrics:<br /><br /><a href=""http://bit.ly/O6LBRi"">http://bit.ly/O6LBRi</a><br /><br />Save yourself from these common misconceptions:<br /><br /><i>1: Branding is marketing / advertising / promotion / anything to that effect.</i><br /><br /><i>2: You are the ultimate authority when it comes to your brand.</i><br /><br /><i>3: There exists a formula for success when it comes to branding.</i><br /><br />Remember that branding isn’t a one-time thing that you do at the beginning of establishing your business. <br /><br /><b>It is an ongoing effort.</b>﻿",link,1393267740,10
-,-,google-plus,106781030971063094758,"Long vs. short landing pages: the advantages and disadvantages of both via <span class=""proflinkWrapper""><span class=""proflinkPrefix"">+</span><a class=""proflink"" href=""https://plus.google.com/115081025762845243709"" oid=""115081025762845243709"">The Next Web</a></span>: <br /><br /><a href=""http://tnw.co/1jQXnfF"">http://tnw.co/1jQXnfF</a>﻿",link,1393267740,18
-,-,google-plus,106781030971063094758,"If you watch this video by <span class=""proflinkWrapper""><span class=""proflinkPrefix"">+</span><a class=""proflink"" href=""https://plus.google.com/108308137946313926397"" oid=""108308137946313926397"">Oli Gardner</a></span>, in  60 minutes... you&#39;ll be a smarter marketer:﻿",link,1393267740,5
-,-,google-plus,106781030971063094758,"<b>Every Digital Marketing Show Ever (In One Place)!</b><br /><br />What if you could get a &quot;graduate level&quot; education in online marketing just by watching videos? And what if you could do it for free?<br /><br />You can! Now every Digital Marketing Excellence Show Hangout ever recorded is in one convenient spot.<br /><br />You&#39;ll watch host <span class=""proflinkWrapper""><span class=""proflinkPrefix"">+</span><a class=""proflink"" href=""https://plus.google.com/113690073826160821557"" oid=""113690073826160821557"">Eric Enge</a></span> interview guests like <span class=""proflinkWrapper""><span class=""proflinkPrefix"">+</span><a class=""proflink"" href=""https://plus.google.com/111294201325870406922"" oid=""111294201325870406922"">Rand Fishkin</a></span>, <span class=""proflinkWrapper""><span class=""proflinkPrefix"">+</span><a class=""proflink"" href=""https://plus.google.com/101696764219780312734"" oid=""101696764219780312734"">Mia Voss</a></span>, <span class=""proflinkWrapper""><span class=""proflinkPrefix"">+</span><a class=""proflink"" href=""https://plus.google.com/104858643838035519891"" oid=""104858643838035519891"">Peg Fitzpatrick</a></span>, <span class=""proflinkWrapper""><span class=""proflinkPrefix"">+</span><a class=""proflink"" href=""https://plus.google.com/114918475211209783081"" oid=""114918475211209783081"">martin shervington</a></span>, <span class=""proflinkWrapper""><span class=""proflinkPrefix"">+</span><a class=""proflink"" href=""https://plus.google.com/113217924531763968801"" oid=""113217924531763968801"">Danny Sullivan</a></span>, <span class=""proflinkWrapper""><span class=""proflinkPrefix"">+</span><a class=""proflink"" href=""https://plus.google.com/109193674823031718540"" oid=""109193674823031718540"">Brian Clark</a></span> and many more. They share their best insights into their areas of expertise. You learn, grow, and become a better marketer!<br /><br /><b>Browse &amp; bookmark at --&gt;</b> <a href=""http://stonet.co/dmeshowarchive"">http://stonet.co/dmeshowarchive</a> and <b>please share</b> this resource with your friends!<br /><br /> <a rel=""nofollow"" class=""ot-hashtag"" href=""https://plus.google.com/s/%23dmeshow"">#dmeshow</a>  ﻿",link,1393267740,1
-,-,google-plus,106781030971063094758,"<b>How to Encourage Google+ Fans to Share Your Content</b><br /><br /><a href=""http://bit.ly/1jgMQb0"">http://bit.ly/1jgMQb0</a><br /><br /><span class=""proflinkWrapper""><span class=""proflinkPrefix"">+</span><a class=""proflink"" href=""https://plus.google.com/111193894818128580437"" oid=""111193894818128580437"">Social Media Examiner</a></span> explains how to find your super fans on Google+ and leverage word-of-mouth marketing on the platform:<br /><br />1. Search Google+ for Potential Candidates<br /><br />2. Mine Google Search for Additional Candidates<br /><br />3. Engage With Your Candidates<br /><br />4. Send a Special Offer and Opt-In Through a Private Email﻿",link,1393267740,12
-,-,google-plus,106781030971063094758,"<b>Landing page optimization</b> is all about making it as easy and attractive as possible for your prospects to say “Yes!” <br /><br /><a href=""http://bit.ly/1gGAiJu"">http://bit.ly/1gGAiJu</a><br /><br /><span class=""proflinkWrapper""><span class=""proflinkPrefix"">+</span><a class=""proflink"" href=""https://plus.google.com/108784242618575374191"" oid=""108784242618575374191"">Michael Aagaard</a></span> explains a <b>dead simple</b> technique for writing customer-centric landing page copy that converts – and it all revolves around <b>one particularly powerful verb</b>.<br /><br /> <a rel=""nofollow"" class=""ot-hashtag"" href=""https://plus.google.com/s/%23CRO"">#CRO</a>  ﻿",link,1393267740,29
-,-,google-plus,106781030971063094758,"All these years we&#39;ve been saying it—and now there&#39;s research to back it:<br /><br /><b>&quot;Haters gonna hate&quot;</b> <br /><br /><a href=""http://wapo.st/18CGHEN"">http://wapo.st/18CGHEN</a>﻿",link,1393267740,3
-,-,google-plus,106781030971063094758,"<b>How to Get Your Leads to Like You More with Facebook Custom Audiences</b> <br /><br /><a href=""http://bit.ly/1bfAZJP"">http://bit.ly/1bfAZJP</a><br /><br />Using the <b>Facebook Custom Audiences</b> feature, there are a number of specific audience groupings and targeting techniques you’ll want to experiment with. <br /><br />If you do any sort of email  <a rel=""nofollow"" class=""ot-hashtag"" href=""https://plus.google.com/s/%23marketing"">#marketing</a>  , you already have a list of people who’ve opted-in to receive your content. If these people haven’t already “Liked” your  <a rel=""nofollow"" class=""ot-hashtag"" href=""https://plus.google.com/s/%23Facebook"">#Facebook</a>  page, they’re an obvious place to start expanding your community. Here are four techniques to get you started:<br /><br />1. Target Page Like Ads to Email Subscribers<br /><br />2. Create Custom Audiences Based on Your Sales Funnel<br /><br />3. Target Customers Who Have Fallen Out of Your Sales Funnel<br /><br />4. Build Lookalike Audiences to Reach Similar Facebook Users<br /><br /><b>Read more</b>: <a href=""http://bit.ly/1bfAZJP"">http://bit.ly/1bfAZJP</a><br /><br /><i>Photo from</i> <span class=""proflinkWrapper""><span class=""proflinkPrefix"">+</span><a class=""proflink"" href=""https://plus.google.com/105085254778178849153"" oid=""105085254778178849153"">eZanga.com</a></span>﻿",link,1393267747,2
-,-,google-plus,106781030971063094758,"Are you on the list for tomorrow&#39;s free <a rel=""nofollow"" class=""ot-hashtag"" href=""https://plus.google.com/s/%23unwebinar"">#unwebinar</a>? <a href=""http://bit.ly/1fLk5lN"">http://bit.ly/1fLk5lN</a>﻿<br /><br />It&#39;s shaping up to be a <b>record breaker</b> for registrants. <span class=""proflinkWrapper""><span class=""proflinkPrefix"">+</span><a class=""proflink"" href=""https://plus.google.com/108308137946313926397"" oid=""108308137946313926397"">Oli Gardner</a></span> is going to show you exactly what marketers are doing wrong—and how to fix your mistakes!<br /><br />Don&#39;t miss out—save your seat: <a href=""http://bit.ly/1fLk5lN"">http://bit.ly/1fLk5lN</a>﻿",link,1393267747,1
-,-,google-plus,106781030971063094758,"<b>Sales</b> or <b>marketing</b>: which department do you think is more valuable in the digital age? <a href=""http://bit.ly/1nzQvAo"" class=""ot-anchor"" rel=""nofollow"">http://bit.ly/1nzQvAo</a>﻿",link,1392747642,3
-,-,google-plus,106781030971063094758,"Who are the top digital marketers that you have circled on Google+?<br /><br />Here&#39;s our list:﻿",link,1392747642,2
-,-,google-plus,106781030971063094758,"You&#39;ve been asking, and we are definitely listening.<br /><br />Responsive has been on our list for a while. <span class=""proflinkWrapper""><span class=""proflinkPrefix"">+</span><a href=""https://plus.google.com/100960646219570654878"" class=""proflink"" oid=""100960646219570654878"">Carter Gilchrist</a></span>, our Director of Product &amp; UX, explains where we&#39;re at so far and the constraints we face:<br /><br /> <a class=""ot-hashtag"" href=""https://plus.google.com/s/%23responsivewebdesign"">#responsivewebdesign</a>   <a class=""ot-hashtag"" href=""https://plus.google.com/s/%23design"">#design</a>  ﻿",link,1392747642,2
-,-,google-plus,106781030971063094758,"<a class=""ot-hashtag"" href=""https://plus.google.com/s/%23Love"">#Love</a> is in the air—love for our customers and friends! Every day we appreciate the support you give us. <br /><br />Thank you so much, and Happy Valentine&#39;s Day.﻿",link,1392747642,5
-,-,google-plus,106781030971063094758,"You’ve seen good landing pages and bad. Great headlines, and headlines that should never again see the light of day. Sometimes, checking them out can kind of be like dating: <a href=""http://bit.ly/1bPNg2L"" class=""ot-anchor"" rel=""nofollow"">http://bit.ly/1bPNg2L</a>﻿<br /><br />Here are 10 landing page examples that led <span class=""proflinkWrapper""><span class=""proflinkPrefix"">+</span><a href=""https://plus.google.com/100072315228420868842"" class=""proflink"" oid=""100072315228420868842"">Eric Sloan</a></span> to both love and heartbreak:<br /><br /><a href=""http://bit.ly/1bPNg2L"" class=""ot-anchor"" rel=""nofollow"">http://bit.ly/1bPNg2L</a><br /><br />Including crushes on <span class=""proflinkWrapper""><span class=""proflinkPrefix"">+</span><a href=""https://plus.google.com/111348367721689165446"" class=""proflink"" oid=""111348367721689165446"">Laura Roeder</a></span>, <span class=""proflinkWrapper""><span class=""proflinkPrefix"">+</span><a href=""https://plus.google.com/102691510059608954072"" class=""proflink"" oid=""102691510059608954072"">HootSuite</a></span> , <span class=""proflinkWrapper""><span class=""proflinkPrefix"">+</span><a href=""https://plus.google.com/108627227803938470069"" class=""proflink"" oid=""108627227803938470069"">Pluralis</a></span> and <span class=""proflinkWrapper""><span class=""proflinkPrefix"">+</span><a href=""https://plus.google.com/105249674535407380106"" class=""proflink"" oid=""105249674535407380106"">ConversionLab</a></span>&#39;s pages. ﻿",link,1392747642,3
-,-,google-plus,106781030971063094758,"In this episode of <span class=""proflinkWrapper""><span class=""proflinkPrefix"">+</span><a href=""https://plus.google.com/107766615336244009979"" class=""proflink"" oid=""107766615336244009979"">Growth Everywhere</a></span> with <span class=""proflinkWrapper""><span class=""proflinkPrefix"">+</span><a href=""https://plus.google.com/112661051788679720552"" class=""proflink"" oid=""112661051788679720552"">Eric Siu</a></span>, we hear how <span class=""proflinkWrapper""><span class=""proflinkPrefix"">+</span><a href=""https://plus.google.com/110287732124387827463"" class=""proflink"" oid=""110287732124387827463"">Todd Garland</a></span>, Founder of <span class=""proflinkWrapper""><span class=""proflinkPrefix"">+</span><a href=""https://plus.google.com/116854641528476786766"" class=""proflink"" oid=""116854641528476786766"">BuySellAds</a></span>, was able to get his company up and running while still maintaining his &quot;day job.&quot;<br /><br /><b>Some top key takeaways:</b><br /><br />Build something people want. Doesn’t matter how good your marketing is if you have a crappy product.<br /><br />Raise money only if you know what you’re going to do with the money.<br /><br />For the first 100 customers, knock on their door and do the unscalable stuff.﻿",link,1392747642,2
-,-,google-plus,106781030971063094758,"Landing page <a class=""ot-hashtag"" href=""https://plus.google.com/s/%23testimonials"">#testimonials</a> need to be trusted before they can have even the faintest influence on conversions and revenue. Here are 4 tricks you can use to make this happen: <a href=""http://bit.ly/1jsZWEo"" class=""ot-anchor"" rel=""nofollow"">http://bit.ly/1jsZWEo</a><br /><br />1. Use testimonials not (necessarily) from “celebrities,” but from <b>trusted experts</b>.<br /><br />2. Use <b>images</b> of your customers and make them the centerpiece of the testimonial.<br /><br />3. Choose testimonials that will rule out the kinds of customers who will be dissatisfied with your product. Arguing against your own short term interests builds <b>credibility</b> faster than almost anything else.<br /><br />4. Choose testimonials that are as <b>precise</b> as possible about the problem they faced and how the product helped, using precise numbers when possible.<br /><br /><b>Read more</b>: <a href=""http://bit.ly/1jsZWEo"" class=""ot-anchor"" rel=""nofollow"">http://bit.ly/1jsZWEo</a>﻿",link,1392747653,7
-,-,google-plus,106781030971063094758,"What was your most &quot;outside the box&quot; marketing idea?﻿",link,1392747659,9
-,-,google-plus,106781030971063094758,"Have you tried using screencasting to create <a class=""ot-hashtag"" href=""https://plus.google.com/s/%23video"">#video</a> content?<br /><br /><a href=""http://bit.ly/1fMnxMp"" class=""ot-anchor"" rel=""nofollow"">http://bit.ly/1fMnxMp</a>﻿",link,1392334345,1
-,-,google-plus,106781030971063094758,"Ahh... the beautiful web <a class=""ot-hashtag"" href=""https://plus.google.com/s/%23design"">#design</a> of the 90s: <a href=""http://on.mash.to/N4sZRz"" class=""ot-anchor"" rel=""nofollow"">http://on.mash.to/N4sZRz</a><br /><br />What the World’s Biggest Websites Looked Like at Launch via Mashable﻿",link,1392334345,7
-,-,google-plus,106781030971063094758,"Have you guys had a chance to check out <span class=""proflinkWrapper""><span class=""proflinkPrefix"">+</span><a href=""https://plus.google.com/112328925975571580805"" class=""proflink"" oid=""112328925975571580805"">Tommy Walker</a></span>&#39;s mega-post on <span class=""proflinkWrapper""><span class=""proflinkPrefix"">+</span><a href=""https://plus.google.com/101720480187950640432"" class=""proflink"" oid=""101720480187950640432"">ConversionXL</a></span> yet?  <br /><br />Tommy pulls some great examples and includes quality recommended reading links to learn more. Worth a bookmark!﻿",link,1392334345,6
-,-,google-plus,106781030971063094758,"Wowza! That a whole lot of tips.<br /><br />Overwhelmed? Don&#39;t be. <br /><br />Because this is no ordinary mega list. It&#39;s a hand-picked, collection of the very best conversion lessons so you can better optimize your landing pages. <br /><br /> <a class=""ot-hashtag"" href=""https://plus.google.com/s/%23conversion"">#conversion</a>   <a class=""ot-hashtag"" href=""https://plus.google.com/s/%23landingpages"">#landingpages</a>   <a class=""ot-hashtag"" href=""https://plus.google.com/s/%23conversionrateoptimization"">#conversionrateoptimization</a>   <a class=""ot-hashtag"" href=""https://plus.google.com/s/%23abtesting"">#abtesting</a>   <a class=""ot-hashtag"" href=""https://plus.google.com/s/%23tips"">#tips</a>  ",link,1378938786,1
-,-,google-plus,106781030971063094758,"[Real World A/B Test] What would make you convert? <br /><br />[A] Pancakes or...<br />[B] Waffles<br /><br /> <a class=""ot-hashtag"" href=""https://plus.google.com/s/%23abtest"">#abtest</a>   <a class=""ot-hashtag"" href=""https://plus.google.com/s/%23abtesting"">#abtesting</a>   <a class=""ot-hashtag"" href=""https://plus.google.com/s/%23justforfun"">#justforfun</a>   <a class=""ot-hashtag"" href=""https://plus.google.com/s/%23conversion"">#conversion</a>  ",link,1378938797,6
-,-,google-plus,106781030971063094758," Fix your broken ecommerce funnel.<br /><br />7 reasons that people are abandoning their carts + 7 ways you can use conversion optimization techniques to reduce cart abandonment + 1 long, stats-filled infographic = an awesome post you should check out.<br /><br /> <a class=""ot-hashtag"" href=""https://plus.google.com/s/%23conversionoptimization"">#conversionoptimization</a>   <a class=""ot-hashtag"" href=""https://plus.google.com/s/%23cro"">#cro</a>   <a class=""ot-hashtag"" href=""https://plus.google.com/s/%23shoppingcartabandonment"">#shoppingcartabandonment</a>   <a class=""ot-hashtag"" href=""https://plus.google.com/s/%23infographic"">#infographic</a>  ",link,1378938797,1
-,-,google-plus,106781030971063094758,"Some brutally, honest  <a class=""ot-hashtag"" href=""https://plus.google.com/s/%23conversion"">#conversion</a> wisdom from <span class=""proflinkWrapper""><span class=""proflinkPrefix"">+</span><a href=""https://plus.google.com/102749272357479111050"" class=""proflink"" oid=""102749272357479111050"">Peep Laja</a></span> :) ",link,1378938797,10
-,-,google-plus,106781030971063094758,"<span class=""proflinkWrapper""><span class=""proflinkPrefix"">+</span><a href=""https://plus.google.com/106781030971063094758"" class=""proflink"" oid=""106781030971063094758"">Unbounce</a></span>  &amp; <span class=""proflinkWrapper""><span class=""proflinkPrefix"">+</span><a href=""https://plus.google.com/101755182665506544613"" class=""proflink"" oid=""101755182665506544613"">Infusionsoft</a></span> combine forces so you can nurture &amp; close your landing page leads!<br /><br />Get the full scoop here: <a href=""http://unbounce.com/partners/infusionsoft/"" class=""ot-anchor"" rel=""nofollow"">http://unbounce.com/partners/infusionsoft/</a>",link,1378938797,0
-,-,google-plus,106781030971063094758,"Headlines. Subject lines. Are SO Important. Whether in an email, on a landing page or Tweet.<br /><br />What&#39;s the best marketing headline you&#39;ve read lately?<br /><br /> <a class=""ot-hashtag"" href=""https://plus.google.com/s/%23marketing"">#marketing</a>   <a class=""ot-hashtag"" href=""https://plus.google.com/s/%23headlines"">#headlines</a>   <a class=""ot-hashtag"" href=""https://plus.google.com/s/%23subjectlines"">#subjectlines</a>   <a class=""ot-hashtag"" href=""https://plus.google.com/s/%23copywriting"">#copywriting</a>  ",link,1378938797,3
-,-,google-plus,106781030971063094758,"In this 11-part instructional course – with awesome videos – landing page expert, <span class=""proflinkWrapper""><span class=""proflinkPrefix"">+</span><a href=""https://plus.google.com/108308137946313926397"" class=""proflink"" oid=""108308137946313926397"">Oli Gardner</a></span>, is joined by 8 world-renowned  <a class=""ot-hashtag"" href=""https://plus.google.com/s/%23conversionrate"">#conversionrate</a> experts to teach you all you need to know to create high-converting  <a class=""ot-hashtag"" href=""https://plus.google.com/s/%23landingpages"">#landingpages</a> .<br />  ",link,1378773192,0
-,-,google-plus,106781030971063094758,"Hello  <a class=""ot-hashtag"" href=""https://plus.google.com/s/%23Conversion"">#Conversion</a>  Heroes.<br /><br />Pro A/B Tester <span class=""proflinkWrapper""><span class=""proflinkPrefix"">+</span><a href=""https://plus.google.com/108784242618575374191"" class=""proflink"" oid=""108784242618575374191"">Michael Aagaard</a></span> wants to put you to the test!<br /><br />Find out how good your marketing intuition is, test your gut feeling and choose A or B.<br /><br />Which  <a class=""ot-hashtag"" href=""https://plus.google.com/s/%23landingpage"">#landingpage</a>  generated the most downloads?",link,1378428703,3
-,-,twitter,wsieservices,"RT @mikoker: Aggregates stink! Here's part 1 of 5 videos about valuable ecommerce metrics - Product Categories! http://t.co/dYVUGne72X",link,1380203049,0
-,-,twitter,avinash,"How to Become Virtually Immortal In a Digital Age: http://t.co/o05sqEB9dg #eternity",link,1396942241,16
-,-,twitter,avinash,"If you are looking for a great PDF Converter, try @PDFElite. They also convert pdf to ppt free online: http://t.co/Y1qwF6ygGZ",link,1396942241,41
-,-,twitter,avinash,"#youarewelcome  [Skip the calories, use data...] How To Handle Food Craving: Handy Graphic: http://t.co/srPMSMdZXx",link,1396942241,83
-,-,twitter,avinash,"Handy dandy collection of slides: The Internet of Everything 2014: Insights: http://t.co/drEhgIRctZ #evolution #revolution",link,1396942241,52
-,-,twitter,avinash,"[Where are all the deliciously awesome book reviews gone? Here's a good one:] Huff and Puff:  http://t.co/wERjMl5TSe",link,1396942254,10
-,-,twitter,avinash,"If you do this in an email, I hate YOU! http://t.co/biAFIfGOtg #haha #ouch",link,1396942254,38
-,-,twitter,avinash,"What Stuff Would You Want After 30 Years in Prison? http://t.co/eMbN40Q7Pv #corrections",link,1396942254,5
-,-,twitter,avinash,"One of the best ads I've seen this week: Guitar Lessons: http://t.co/ILXYzm65SL #haha #creativity",link,1396942254,40
-,-,twitter,avinash,"A parent? Check out @HankAzaria's documentary Fatherhood: http://t.co/hOwneZGIas (All web based, free) #awesome",link,1396942254,19
-,-,twitter,avinash,"[Your future state in a graph, by country!] Relationship between happiness and age: http://t.co/hU1QppeLHI #infographic",link,1396942254,23
-,-,twitter,avinash,"Looking to combines multiple data sources + efficiently deliver insights? Here's @sweetspot by @sergiomaldo http://t.co/FamlGoxPj5",link,1396942254,43
-,-,twitter,avinash,"In Remote Bjørndalen, Norway, a Small Cabin Enjoys Some of the World's Fastest Internet: http://t.co/GwvK8xGkBn #priorities :)",link,1396942254,17
-,-,twitter,avinash,"Last year, 71 million people watched other people play video games: http://t.co/rNnowNJpNl #omg #entertainment",link,1396942254,28
-,-,twitter,avinash,"My friend @AdamSinger, GA Marketing, has produced a wonderful album of jazz music.Free download http://t.co/TLZSGJoNY9 #passion",link,1396942254,13
-,-,twitter,avinash,"The Problem With Self-Driving Cars: They Don't Cry: http://t.co/frHVodleVq #thevalueofemotion",link,1396942254,9
-,-,twitter,avinash,"""The best place to hide a dead body is page 2 of Google search results.""   : )    via Brian Clark #word",text,1396942254,293
-,-,twitter,avinash,"Gun laws in the US, state by state: Infographic + observations: http://t.co/tkMdORCqAn #themoreyouknow",link,1396942254,5
-,-,twitter,avinash,"Secrets of the Math Men: http://t.co/dI1OO8Mv8D #profitablemarketing",link,1396942254,17
-,-,twitter,avinash,"[Ideas to improve your YT presence:] YouTube Brand Channels Leaderboard: March 2014: http://t.co/uyj9EYVRBd",link,1396942254,23
-,-,twitter,avinash,"""What would happen if Communism were introduced to Saudi Arabia? Nothing—at first. But soon there’d be a shortage of sand."" #newyorker",text,1396942254,36
-,-,twitter,avinash,"Guess who has a lower acceptance rate, Wal-Mart or Harvard? You guessed wrong, it's Wal-Mart! http://t.co/aJPJlEIBTU #choice",link,1396942254,22
-,-,twitter,avinash,"""Silence is better than bullshit."" -Anonymous #psa",text,1396942254,117
-,-,twitter,avinash,"Fm Cocaine 2 Meth 2 McDonalds... Get your vice on! Cheapest and most expensive places in the world: http://t.co/12oRAHbjXp",link,1396942254,5
-,-,twitter,avinash,"Can we close the pay gap between CEOs and Workers? Should we? http://t.co/n21uA4t5LP #foodforthought",link,1396942254,16
-,-,twitter,avinash,"New metric now available to measure performance of your Google+ efforts: http://t.co/QSxtjh2Hto #smartdata",link,1396853950,42
-,-,twitter,avinash,"The Oldest Living Organisms in the world: http://t.co/ADVYZsXphl [The oldest is 100,000 years old.] #life",link,1396853950,12
-,-,twitter,avinash,"Security Guards Outnumber High School Teachers in the United States: http://t.co/CpKWzAq0y3 #wow",link,1396853919,27
-,-,twitter,avinash,"A Breakup Letter to Facebook from @eat24 : http://t.co/xEXRK1S1Js #awesome",link,1396853919,83
-,-,twitter,avinash,"What are the 10 best sentences ever to appear in novels? Wonder no more: http://t.co/mxcFB5Xm5b",link,1396853919,25
-,-,twitter,avinash,"Everyday Objects Hilariously Redesigned in Ridiculous Ways: http://t.co/bIWX20vQdU #creativity",link,1396853919,30
-,-,twitter,avinash,"""You are free to choose, but you are not free to alter the consequences of your decisions."" -Ezra Taft Benson #foodforthought",text,1396853919,74
