country,industry,source,name,text,type,created_at,rating
-,-,twitter,avinash,"[via @baekdal] Mom: ""Katy, you can't do a Kickstarter campaign for a pony."" Wait, what... http://t.co/h47jGRx5fp",link,1384334191,39
-,-,twitter,avinash,"So... how honest are we when no one is looking? Results from a interesting social experiment: http://t.co/DSjeevIcEX #surprises",link,1384334191,31
-,-,twitter,avinash,"Guess which favourite sweet treat is made of: bones, skins, leftover animal parts, coal tar? Gummy Bears! http://t.co/Mtu8TfwLNG",link,1384334191,38
-,-,twitter,avinash,"Dilbert on Data Accuracy: http://t.co/tkimfVVeOp [Laugh at your pain, laugh at your pain.... :)]",link,1384334191,47
-,-,twitter,avinash,"If you use the Google Analytics URL Builder, here's a much better one:  http://t.co/hDYSoQTblI #campaigntracking #trackorfail",link,1384334191,106
-,-,twitter,avinash,"Thanks for all the fish @LoyaltyOneInc @colloquy! I appreciate the open minds and love for the new ideas. #yourock #CQYSummit",text,1384334191,6
-,-,twitter,avinash,"Travis Sigley is a professional cuddler. Yes, that means he cuddles, for money. http://t.co/J7nHqkOHWt #life #love",link,1384334191,3
-,-,twitter,avinash,"[In case you missed it, my short post] The Value of Appreciating the Everyday Obvious: http://t.co/8heQGx0mTn  #benefits",link,1384334191,7
-,-,twitter,avinash,"Using Data to Grow Your Startup: My @dormroomtycoon Podcast: http://t.co/nAWU9udPL0 Loads of examples to re-think marketing/data.",link,1384334191,26
-,-,twitter,avinash,"[In case you missed it, my short post] The Value of Appreciating the Everyday Obvious: http://t.co/8heQGx0mTn #benefits",link,1384334191,12
-,-,twitter,avinash,"What happened to you, Google? http://t.co/HkkStkoiIE #criticism",link,1384334191,64
-,-,twitter,avinash,"How to increase conversion rate? 3 best metrics for any business? My answers, video: http://t.co/CNkK2WB40I #rockmorewithdata",link,1384334191,54
-,-,twitter,avinash,"""Girls gone average. Averages gone wild."" - Simpson's Paradox http://t.co/8uSfFMWNYq #themoreyouknow",link,1384334191,15
-,-,twitter,avinash,"[Absolutely incredible!]  3 Ingenious Designs That Will Fool Your Eyes:  http://t.co/vyKPXLEoec  #creativity",link,1384334191,15
-,-,twitter,avinash,"What happens when a father, alarmed by his 13-yr-old daughter's nightly workload, tries to do her homework for a week http://t.co/fIjeA5xMhZ",link,1384334191,33
-,-,twitter,avinash,"2 surprising places I've seen a GoPro camera recently: On a eagle (!) http://t.co/IctdhnddhC Bridal Bouquet http://t.co/bLT1zuKS3a",link,1384334191,12
-,-,twitter,avinash,"Is Apple's Touch ID hacked yet? http://t.co/quXANQc5VM #themoreyouknow",link,1384334191,14
-,-,twitter,avinash,"From India, portraits of vanishing jobs: http://t.co/1ONmsOAapU #incredible #creativity #evolution",link,1384334191,15
-,-,twitter,avinash,"In New York, an “artisanal” pencil sharpener who charges $35 a pencil. Yes. $35 to sharpen a pencil. Video http://t.co/dQaa0gxV0F",link,1384334191,37
-,-,twitter,avinash,"A Year of Incredible Space Photos: Royal Observatory's Winning Images: http://t.co/lxpdtHVmoo #inspiration",link,1384334191,7
-,-,twitter,avinash,"A cup of coffee inspires self-reflection and appreciation. My short post: http://t.co/OSKgyV1q9Y #motivation",link,1384334191,13
-,-,twitter,avinash,"Which US states have the most homicides in which firearms were used? Where has gun crime fallen? Graphic http://t.co/dDhlJgGViU",link,1384334191,6
-,-,twitter,avinash,"No matter what your religion, we can all get behind Pope Francis: http://t.co/GhTc4F22xW #lifelibertyandthepursuitofhappiness",link,1384334191,15
-,-,twitter,avinash,"25 Productivity Secrets from History's Greatest Thinkers: http://t.co/e3Psi0kiX9 #greattips #productivity",link,1384334191,39
-,-,twitter,avinash,"""The next mass shooting will take place on Feb 12, 2014, in Spokane, Washington."" http://t.co/H8BNeAJ85z #predictiveanalytics",link,1384334191,37
-,-,twitter,avinash,"""You can't teach creativity; all you can do is let it blossom, and it blossoms in play."" http://t.co/wSsP2iKRy9 #importantinsight",link,1384334191,26
-,-,twitter,avinash,"Can Google Solve Death? Calico: http://t.co/93OC8ohcaC #moonshots",link,1384334191,17
-,-,twitter,avinash,"The Boy Genius of Ulan Bator: http://t.co/wWflR08CKm [Powered by a great heart, MOOCs and 3 mpbs web! :)] #inspiration",link,1384334191,13
-,-,twitter,avinash,"4 landing page optimization lessons from the world's greatest landing page: http://t.co/TjJOUcRNyW #rockmore",link,1384334191,57
-,-,twitter,avinash,"Download 6 segments, 9 custom reports, a VP Dashboard created by me into your Google Analytics account! Go http://t.co/D9yph5w70V",link,1384334191,100
-,-,twitter,avinash,"How the bluefin tuna, which was previously used for dog/cat food, became a prized delicacy: http://t.co/qaglYDd7lN #foodforthought",link,1384334191,11
-,-,twitter,avinash,"My short post on career advice, marketing and customer centricity: *Don’t Use a Blackberry* http://t.co/vzfaD7M7iz",link,1384334191,19
-,-,twitter,avinash,"Australian/in Australia late nov? Get good at Analyse + Predict + Influence at the Data Strategy Symposium http://t.co/TpmQuFTnIH",link,1384334191,10
-,-,twitter,avinash,"US lifespan has doubled over 150 years. Fm cotton to window screens, 14 oddball reasons you're not dead yet. http://t.co/2ID0sDlbQV",link,1384334191,12
-,-,twitter,avinash,"[Career advice, marketing lesson, customer-centricity rolled into one. My post:] Don't use a Blackberry: http://t.co/0Uu9XPToMh",link,1384334191,15
-,-,twitter,avinash,"The Cover Letter: A History of Every Job-Seeker's Greatest Annoyance http://t.co/xUwmhQNU3R [Did u know da Vinci wrote the 1st CV?]",link,1384334191,10
-,-,twitter,avinash,"Public universities shifting their aid, giving less to the poorest students and more to the wealthiest: http://t.co/HiPjuozr9u #wow",link,1380632441,5
-,-,twitter,avinash,"A cautionary tale: Why you don't invite your mother to the office: http://t.co/BMEK4q4mlL #life #lessons",link,1380632441,9
-,-,twitter,avinash,"""Stop looking at social media websites, instead work out what contribution you can make to the world, and go do it."" http://t.co/sAHfT3qIFj",link,1380632441,39
-,-,twitter,avinash,"Lil Bub is a dominant player in the competitive world of cute Internet cats. Here's how she's building an empire http://t.co/2bZvnPTkZi",link,1380534713,5
-,-,twitter,avinash,"'Beer goggle' study and other winners of the Ig Nobel awards: http://t.co/fDny8JiA4D #awesomeness",link,1380534713,8
-,-,twitter,avinash,"The IPhone's Secret Flights From China to Your Local Apple Store: http://t.co/AmszQmZjjA #logistics #win",link,1380534713,15
-,-,twitter,avinash,"In a Breathtaking First, NASA’s Voyager 1 Exits the Solar System: http://t.co/OWNT836r85 #toinfinityandbeyond #govoyagergo",link,1380534713,16
-,-,twitter,avinash,"Maria Konnikova: How Facebook Makes Us Unhappy: http://t.co/qjPkfvxf17 #foodforthought",link,1380534713,20
-,-,twitter,avinash,"A fun 30 min video interview about analytics, marketing, smart digital frameworks: http://t.co/ZsbfarBu81 #metalkprettyoneday",link,1380534713,53
-,-,twitter,avinash,"[My thoughts on Twitter's IPO:] Tweet, Tweet, $$, $$, Tweet, Tweet! http://t.co/VBz3gnEYq1 #conversation #marketing",link,1380534713,16
-,-,twitter,avinash,"[I'm not a LinkedIn virgin anymore, my first post: @twitter IPO!] Tweet, Tweet, $$, $$, Tweet, Tweet! http://t.co/RHWq6mkAyp",link,1380534713,16
-,-,twitter,avinash,"Your new favourite Twitter feed: Middle Class Problems: @middleclassprob http://t.co/FibucgGFjf #awesome",link,1380534713,11
-,-,twitter,avinash,"""The chart Tim Cook doesn't want you to see"" Really? http://t.co/Jx7jAdrq1g A short lesson in data intrepretation. #apple #omg",link,1380534713,14
-,-,twitter,avinash,"From KPIs &amp; dashboards to customer centricity? http://t.co/MJaqUydFfU [Industry/People: Stop solving for data puking!] #howtowin",link,1380534713,29
-,-,twitter,avinash,"As a headphones snob, I'm really impressed with my new Sennheiser Momentum. Less ear crushing, clear music. http://t.co/eRmHnTI2P9",link,1380534713,27
-,-,twitter,avinash,"Un Petit Monde, a photo project that places miniature figures in the real-world settings: http://t.co/qi2Cjpmha1 #creativity",link,1380534713,10
-,-,twitter,avinash,"""It's not that I'm so smart, it's just that I stay with problems longer."" -Albert Einstein #persistence",text,1380534713,58
-,-,twitter,avinash,"[I passionately recommend this:] Seeing the Elephant: Defragmenting User Research: http://t.co/L4iOz80Nbc #qualplusquant",link,1380534713,34
-,-,twitter,avinash,"""The only thing that stops a bad guy with a mailbox is a good guy with a mailbox."" http://t.co/nI0YNS5ZEg #omg",link,1380534713,5
-,-,twitter,avinash,"Turns out Multi-Arm Bandit is not an octopus holding many guns! It is an excellent analtyical technique: http://t.co/AJJYZW3Ayt",link,1380534713,10
-,-,twitter,avinash,"Errol Morris: How to Interview Someone: Shut up and listen http://t.co/7twEkLMyRW #usefuladvice",link,1380534713,8
-,-,twitter,avinash,"Life expectancy doubled in the past 150 years. Here’s why: http://t.co/5lnk70Jj9h #livelongandprosper",link,1380534713,12
-,-,twitter,avinash,"Focus data segmentation on Visitors not Visits! Unlock profitable insights. Post: http://t.co/r4hoQGCNJm http://t.co/oSYFsFdgIJ",link,1380534713,75
-,-,twitter,avinash,"Your new favourite site for dataviz inspiration: WTF Visualizations: http://t.co/YYJzgAOwrO #awesome",link,1380534713,24
-,-,twitter,avinash,"[My post] Focusing on Visitor Segmentation, rather than Visits or Hits, unlocks new analytical goodness! http://t.co/r4hoQGCNJm",link,1380534713,57
-,-,twitter,avinash,"Don't know much about Syrian history? Here's a very simple overview -with lots of pictures: http://t.co/T1PHs0hp4r #creativity",link,1380534713,29
-,-,twitter,avinash,"Do American parents spend too much time volunteering at their kids’ schools? http://t.co/eiGL52dQwO #alternatives #smarterkids",link,1379924923,7
-,-,twitter,avinash,"Parents passive aggressive notes to their kids http://t.co/id09jaiepx #awesome #creativity #goodparenting",link,1379924923,30
-,-,twitter,avinash,"Why Did Kamikaze Pilots Wear Helmets? http://t.co/H4bUVvUKMJ #nowyouknow",link,1379924923,11
-,-,twitter,avinash,"My new favourite Google Doodle comes from Google Brazil. It is amazing: http://t.co/I9Oeiqgskx #culture",link,1379924923,15
-,-,twitter,avinash,"So how much money can you make crowdworking on the internet? http://t.co/vV7AORbyZo [Great schemes, but $40 for 37 hrs of work!]",link,1379924923,12
-,-,twitter,avinash,"Data that surprises: The top 10 busiest air travel routes in the world: http://t.co/XwafSe0N40 (Surprise #1, no USA!)",link,1379924923,15
-,-,twitter,avinash,"Multi-Channel Attribution Modeling: Good, Bad and Ugly Models: http://t.co/iwCyUsAR2c  #adviceyoucanuse #thinkdifferent",link,1379924923,45
-,-,twitter,avinash,"Optimize AdWords 4 online conversions =Been there, done that. Boring. Optimizing AdWords 4 offline =OMG! http://t.co/NGfIP5e7XM",link,1379924923,40
-,-,twitter,avinash,"15 things u probably didn't know about Google http://t.co/s2ciLQaxhU (#2 Google has acquired one company every week since 2010)",link,1379924923,78
-,-,twitter,avinash,"Interactive Map Compares the New York City of 1836 to Today: So awesome: http://t.co/WvrvoR8VY8 #perspective",link,1379659759,22
-,-,twitter,avinash,"Face the single greatest instagram page you'll ever see: mrpimpgoodgame: http://t.co/eeNLU5K0Q4 Did I say face? :) #creativity",link,1379659759,21
-,-,twitter,avinash,"When Twitter wants to search its archives, it doesn't use Twitter search: http://t.co/8nNuw2GTad :)",link,1379659759,38
-,-,twitter,avinash,"[Using data to incentivise healtheir choices!] Google crunches data on munching in office: http://t.co/eMUv3VFQiN #yummy",link,1379659759,14
-,-,twitter,avinash,"Some say the world will end in fire. Some say ice. Some say kamikaze attacks on the power grid by squirrels! http://t.co/BwPikqC7Ef",link,1379659759,5
-,-,twitter,avinash,"The inimitable @chrisbrogan has launched a wonderful magazine for work, life and everything in between: http://t.co/yJaRhaa70I #go",link,1379659759,4
-,-,twitter,avinash,"How Brazil’s richest man, Eike Batista, lost 97% of his fortune in less than two years: http://t.co/yr0yA3jX31 #life #business",link,1379659759,18
-,-,twitter,avinash,"The Changing Nature of the American Household: Incredible data (+my mini-blog post) http://t.co/peYFQ1BdwC #goodolddaysaregone",link,1379484166,22
-,-,twitter,avinash,"Just Delete Me: A directory of direct links to delete your account from web services: http://t.co/kcGuVRIXf4 #awesome",link,1379484166,80
-,-,twitter,avinash,"Microsoft buys Nokia! Hurray! Short blog post on Microkia: http://t.co/FyYMkAlJLP #innovation",link,1379484166,22
-,-,twitter,avinash,"#Nokia's Twitter bio: ""Indestructible. Since 1865."" #Microsoft's cash, now guarantees that! http://t.co/ujhUqrUqIm #innovation",link,1379484166,29
-,-,twitter,avinash,"Heroine of the year: Diana Nyad: Her first attempt was 35 years ago, she succeed on her fourth one! http://t.co/yGQaqtNOWQ",link,1379484166,28
-,-,twitter,avinash,"[Malcolm Gladwell!] Man and Superman: In athletic competitions, what qualifies as a sporting chance? http://t.co/3loB0YXm2f",link,1379484166,8
-,-,twitter,avinash,"You take out a S and magically you from exclusive to inclusive. http://t.co/RDa4MHAOgn #lifelibertyandthepursuitofhappiness",link,1379484166,10
-,-,twitter,avinash,"10 Paragraphs About Lists You Need in Your Life Right Now: http://t.co/rkgKvR9mzT #nowyouknow",link,1379484186,16
-,-,twitter,avinash,"Popularity + gender balance of elective cosmetic surgeries in the USA: Dataviz: http://t.co/1LzGZdnVNb #melookprettyoneday",link,1379484186,2
-,-,twitter,avinash,"The 7 Kinds of E-mail Vacation Auto-Responders Everyone Hates: http://t.co/9GOtF6kRy6 #goodadvice",link,1379433079,34
-,-,twitter,avinash,"""Whether you can win or not in a fight that is important, get caught trying... be found trying."" - Bill Clinton #word",text,1379433079,9
-,-,twitter,avinash,"[Ironic source, great quote:] ""Big will not beat small anymore - it will be the fast beating the slow."" -Rupert Murdoch #word",text,1379433079,28
-,-,twitter,avinash,"The magnificent @randfish will be doing the next @MarketMotive webinar. Be there, get smarter! http://t.co/jsagw4tNNv",link,1379433079,21
-,-,twitter,avinash,"[Thx @TheArtOf!] You Are What You Measure, So Choose Your Incentives Wisely! http://t.co/cbydmjBPdK #thinkdifferentorperish",link,1379433079,16
-,-,twitter,avinash,"Lessons from Amazon, and digital commerce losers, on how to do ecommerce right: My post: http://t.co/jxlCsFxJKG #nowyouknow",link,1379433079,59
-,-,twitter,avinash,"[Just backed this kickstarter:] Pressy - the Almighty Android Button! by Nimrod Back: http://t.co/SrQx1BUxCj #cool #practical",link,1379433079,7
-,-,twitter,avinash,"You cannot improve one thing by 1000% but you can improve 1000 little things by 1%. -Jan Carlzon [Post: http://t.co/p5PRtH6sIB]",link,1379433079,39
-,-,twitter,avinash,"Amazon has won fair &amp; square. It has also benefited from the incompetence of its competitors. My post: http://t.co/Wf74em8d28",link,1379433079,31
-,-,twitter,avinash,"[Digital disruption reaches the world's oldest profession] ""Brothels Suffer as Web Disrupts Oldest Trade"" http://t.co/Ip9VzW2aE9",link,1379433079,13
-,-,twitter,avinash,"[This is an incredible human story] Return to the rainforest: A son's search for his Amazonian mother: http://t.co/fYe4cRAYBg #life",link,1379433079,10
-,-,twitter,avinash,"FOMO: Fear of Missing Out. (See, we all do learn something new every day! :)) #nowyouknow",text,1379433079,15
-,-,twitter,avinash,"Turns out the Romans were nanotechnology pioneers! 1,600-Year-Old proof: http://t.co/Aw1SqauvWj #amazing #science",link,1379433079,11
-,-,twitter,avinash,"My new favourite office location in all of Google.... The hammock room in Sao Paulo, Brazil: http://t.co/YQz3Ivtz0R #lifework",link,1379433079,13
-,-,twitter,avinash,"""I genuinely believe no one has ever learned anything from success. Success is like a really distorting mirror."" -Moby #word",text,1379433079,27
-,-,twitter,avinash,"What are some of the funniest and most clever advertisements? Answer: http://t.co/UW8RAiHNW8 #awesome",link,1379433079,32
-,-,twitter,avinash,"A look at the psychology around bad driving: http://t.co/75XxrjLRyQ #3: “We forget that other drivers are people too.” #science",link,1379433079,10
-,-,twitter,avinash,"An Engineer, mathematician, physicist walk into a restaurant... discuss splitting the check: http://t.co/qy6b3Y5MWN #awsm #math",link,1379433079,27
-,-,twitter,avinash,"Social spamming trends: @twitter edition: http://t.co/zNUF1WGyqL  Mini-blog post on smart spamming, incentives 4 bad behavior.",link,1379433079,15
-,-,twitter,avinash,"Social spamming trends: Twitter edition: http://t.co/zNUF1WGyqL Mini-blog post on smart spamming, incentives for bad behavior.",link,1379433079,18
-,-,twitter,avinash,"Racial equality and 50 years of progress, or lack there of, in six simple graphs: http://t.co/AWj2wqG9wu #weshallovercome",link,1379433079,14
-,-,twitter,avinash,"Are you a digital analytics superhero? The president needs you. No really. Need #1 http://t.co/cTd8dmdJJ8 #2 http://t.co/tk4QRD1RyC",link,1379433079,34
-,-,twitter,avinash,"I'm tweeting this week at @NordicPerform as well. Follow along for some marketing/analytics/digital fun! [Thx @OlaHano!]",text,1379433079,9
-,-,twitter,avinash,"Can nice guys finish first? A facinating profile of Apple CEO Tim Cook: http://t.co/3aTPLI5No3 #leadership",link,1379433079,28
-,-,twitter,avinash,"""Even if President Obama doesn’t pardon Manning, history will."" http://t.co/x17fv0BFSZ #accountability",link,1379433079,19
-,-,twitter,avinash,"One cool impact of Mr. Snowden is that the government is trying to ""leak"" stuff faster than him! http://t.co/yfgmtFpuf5 #sunshine",link,1379433079,9
-,-,twitter,avinash,"The Tower of Pisa and other big design failures: Infographic: http://t.co/qpzjgNgiN6 #lessons",link,1379433079,12
-,-,twitter,avinash,"The Future of Customer Attribution Models (by @baekdal): http://t.co/6o3flxvUNl #insights #foodforthought",link,1379433079,74
-,-,twitter,avinash,"Web Site Down? How Dare You!  http://t.co/99gAFgd4C7 #expectations",link,1379433079,12
-,-,twitter,avinash,"(So gosh darn amazing!) London Panorama Drawing - the view from the Shard: http://t.co/zfKD82php6 #creativity",link,1379433079,8
-,-,twitter,avinash,"Why are we having so much trouble printing the new hundred-dollar bill? http://t.co/qsrju3Z8cD #design #security #ohmy",link,1379433079,3
-,-,twitter,avinash,"Help please. Could you share an example of a Tech/Phone/Electronics company that on the site does See,Think,Do well. http://t.co/lOENlWzHzK",link,1379433079,10
-,-,twitter,avinash,"Can Good Graphic Design Help The Homeless? Business + innovation + design: http://t.co/NghqrYrGPj #hmmm #creativity",link,1379433079,12
-,-,twitter,avinash,"The first rule of having in-flight internet access is...  http://t.co/xmxx9QradY #nowyouknow",link,1379433080,16
-,-,twitter,avinash,"New book: Quick Start Guide to Affiliate Marketing by @ePrussakov http://t.co/JKcnTL956Z #affordable #goodadvice",link,1379433080,24
-,-,twitter,avinash,"What do you conclude when someone doesn't answer your phone call? http://t.co/a6q7c5OIKR #haha #reality",link,1379433080,17
-,-,twitter,avinash,"The Kindly Brontosaurus: The amazing, prehistoric posture that will get you whatever you want: http://t.co/aW53g3i2Pn #goodadvice",link,1379433080,10
-,-,twitter,avinash,"Engine: The History of a Concept, From 14th-Century Poetry to Google: http://t.co/8DXra5XqrF #nowyouknow",link,1379433080,7
-,-,twitter,avinash,"How Dr. Seuss Beat Writer’s Block://vrl.ht/1624 #inspiration #sillyhats",text,1379433080,8
-,-,twitter,avinash,"Pie Charts for Math Nerds: http://t.co/1pRTtrtnYL #awesome #video",link,1379433080,20
-,-,twitter,avinash,"Interview w/ one of my data heroes @junkcharts : ""Numbersense Pros: Avinash Kaushik"" http://t.co/q6zZIv0FwN (See my fav stats book)",link,1379433080,15
-,-,twitter,avinash,"A photo essay about letting go that will probably resonate with many parents and/or immigrants. http://t.co/1AA2odhtqf #life",link,1379433080,6
-,-,twitter,avinash,"""40 Hyper Realistic Artworks That Are Hard to Believe Aren’t Photographs | Bored Panda "" http://t.co/9RCJBPml3m #wow #creativity",link,1379433080,19
-,-,twitter,avinash,"""Attribution in online marketing: a Big Data problem"" http://t.co/hg9VBDEZtR #understand #execute",link,1379433080,42
-,-,twitter,avinash,"With @mitchjoel a podcast ""When Fish Climb Trees And Other Stories With Avinash Kaushik"" http://t.co/KhuA2eQ29S #thinkdifferent",link,1379433080,7
-,-,twitter,avinash,"What has Edward Snowden done for Barack Obama? ""Rush him."" http://t.co/3tW0lWnXay #sunshine",link,1379433080,6
-,-,twitter,avinash,"How BlackBerry Fell:  http://t.co/ZBoiulDERo  #innovation",link,1379433080,18
-,-,twitter,avinash,"Multi-Channel Attribution Modeling: Good, Bad and Ugly Models: http://t.co/iwCyUsAR2c #read #comment #share #rock",link,1379433080,71
-,-,twitter,avinash,"[My new post, bring an open mind:] Multi-Channel Attribution Modeling: Good, Bad and Ugly Models: http://t.co/iwCyUsAR2c #analysis",link,1379433080,40
-,-,twitter,avinash,"Recycling bins in London are monitoring the phones of passers-by, so advertisers can target messages! http://t.co/gNWqCvWmRp",link,1379433080,28
-,-,twitter,avinash,"Browser market shares and the impact of innovation: http://t.co/RBMmnhcc2l",link,1379433080,18
-,-,twitter,avinash,"The most bizarre contraband items being confiscated around the world: http://t.co/4ALLyUcHcI #creativity #omg",link,1379433080,6
-,-,twitter,avinash,"A Patch Designed To Make You Invisible To Mosquitoes: http://t.co/BV1gjxJ4gW #practicalinnovation #goscience!",link,1379433080,10
-,-,twitter,avinash,"Teacher catches student using phone in class, gives him a math problem to unlock the phone:  http://t.co/r8DKeBxAB8 #awesome",link,1379433080,54
-,-,twitter,avinash,"What do George Bush, Muhammad, Global Warming &amp; Anarchism have in common? Most controversial wikipedia entries http://t.co/KwA1iBiT3Y",link,1379433080,4
-,-,twitter,avinash,"I was researching bi-polar disorder and at the back of my mind was this thought: ""I wonder what this tells the NSA about me.""",text,1379433080,30
-,-,twitter,avinash,"Overrated &amp; Underrated elements of work/life: My mini-blogpost: http://t.co/oniTEov5eP #carpediem",link,1379433080,22
-,-,twitter,avinash,"Why have full-scale SWAT raids become commonplace occurrences? The militarization of the US police: http://t.co/X1CsQP8tN2",link,1379433080,13
-,-,twitter,avinash,"I don't think you realize how far Google takes this experimentation/testing thing. Check this out: http://t.co/2EU8K9XUZD",link,1379433080,41
-,-,twitter,avinash,"What? Me? On the Bing blog? Pimping Bing? Yes! Bing's cool experimentation platform: http://t.co/WZNPZFdjc2 #thinksmartmovefast",link,1379433080,18
-,-,twitter,avinash,"Excellent Analytics Tip #21: Convert Complex Data Into Simple Logical Stories: http://t.co/LaRopuc3zV #information2action",link,1379433080,50
-,-,twitter,avinash,"Explorer Story: Alex Blaszczuk: We have a long way to go. But what an incredible first step. http://t.co/dFjcqCUgRe #innovation",link,1379433080,14
-,-,twitter,avinash,"Big brains +big heart +big passion = @mitchjoel Spent a fun afternoon w/ him bouncing Big Ideas! #love http://t.co/k5dMsFZlyO",link,1379433080,13
-,-,twitter,avinash,"Jeff Bezos' 10,000 Year Clock: http://t.co/kugA1T80OB #thinkdifferent",link,1379433080,16
-,-,twitter,avinash,"God vs. Free Gay Po rn: Insights about US Population: Graph: http://t.co/hAXkmd9JPX #omgisthatwhatwereallydo!",link,1379433080,19
-,-,twitter,avinash,"#intrestingchoices The poor European country building three churches a week: http://t.co/fpWQbLZTKn",link,1379433080,4
-,-,twitter,avinash,"A look at South Korea's educational system (ranked among the best in the world) &amp; its $4 million teacher: http://t.co/qi3xsXrhoo",link,1379433080,30
-,-,twitter,avinash,"“The eye sees only what the mind is prepared to comprehend.” -Henri Bergson #foodforthought",text,1379433080,39
-,-,twitter,avinash,"I'm doing Hangouts each Thursday for the AdWords Online Marketing 101 MOOC. Video with insightful Q&amp;A: http://t.co/Ci8x2sVDi9",link,1379433080,26
-,-,twitter,avinash,"Free Webinar Series for Digital Marketing Team Managers (With ME!!): Aug 15: Sign. Up. Now!: Free: http://t.co/KxPFF9A4Wq",link,1379433080,37
-,-,twitter,avinash,"""Football"" from the American perspective: Video: http://t.co/XNL7LR4y9j #beyondawesome",link,1379433080,9
-,-,twitter,avinash,"Website Requirements and Where Analytics Folks Stand: http://t.co/7TUBEylmrG http://t.co/ntegHoVVRs #goodadvice",link,1379433080,36
-,-,twitter,avinash,"Should you worry about the bounce rate of your website? http://t.co/QVD94SUkSj #mostlyyes #seetipsonhowtopossiblylowerit",link,1379433080,30
-,-,twitter,avinash,"Still smiling: Meet the man who has been in hospital for 45 years: http://t.co/0xNK2d228J #incredible #inspiration",link,1379433080,13
-,-,twitter,avinash,"And now, information you *need* to know: Squatting for proper toilet posture http://t.co/4Tm5iWhbg2 #know #dosomethingaboutit",link,1379433080,17
-,-,twitter,avinash,"Winners of the 2013 National Geographic Traveler Photo Contest - In Focus: http://t.co/2ilLPpk7yi #creativity",link,1379433080,15
-,-,twitter,avinash,"New York Times bought The Boston Globe for $1.1 billion in 1993. Sold it today for $70 million. http://t.co/51ijxCXk8x #omg",link,1379433080,52
-,-,twitter,avinash,"The 20 Most Inspiring Entries in Red Bull's Epic Photo Contest: http://t.co/INdmZuSinS #omg #awesome #creativity",link,1379433080,39
